No,;Time;Source;Destination;Protocol;Length;Info;;Time 1;Time 2;Delay;;Delay 1;Delay 2;Jitter
2;0,119162;162.159.130.234;192,168,100,21;TLSv1,2;271;Application Data;;0,119162;0,173849;0,054687;;0,04036;0,014327;-0,026033
4;0,173849;192,168,100,21;162.159.130.234;TCP;54;61541  >  443 [ACK] Seq=1 Ack=218 Win=508 Len=0;;0,173849;0,188176;0,014327;;0,009555;0,004772;-0,004783
5;0,188176;162.159.130.234;192,168,100,21;TLSv1,2;215;Application Data;;0,188176;0,192948;0,004772;;-0,037731;0,042503;0,080234
6;0,192948;50,116,58,41;192,168,100,21;TCP;68;8443  >  51145 [ACK] Seq=1 Ack=1 Win=165 Len=0 SLE=4294967269 SRE=1;;0,192948;0,235451;0,042503;;-0,003304;0,045807;0,049111
7;0,235451;192,168,100,21;162.159.130.234;TCP;54;61541  >  443 [ACK] Seq=1 Ack=379 Win=514 Len=0;;0,235451;0,281258;0,045807;;-0,115169;0,160976;0,276145
8;0,281258;192,168,100,21;157,240,218,60;TLSv1,2;93;Application Data;;0,281258;0,442234;0,160976;;0,103021;0,057955;-0,045066
10;0,442234;192,168,100,21;162.159.130.234;TLSv1,2;108;Application Data;;0,442234;0,500189;0,057955;;0,013752;0,044203;0,030451
11;0,500189;162.159.130.234;192,168,100,21;TLSv1,2;266;Application Data;;0,500189;0,544392;0,044203;;0,017594;0,026609;0,009015
12;0,544392;192,168,100,21;162.159.130.234;TCP;54;61541  >  443 [ACK] Seq=55 Ack=591 Win=513 Len=0;;0,544392;0,571001;0,026609;;0,026605;4E-06;-0,026601
13;0,571001;162.159.130.234;192,168,100,21;TLSv1,2;254;Application Data;;0,571001;0,571005;4E-06;;-0,000119;0,000123;0,000242
14;0,571005;162.159.130.234;192,168,100,21;TCP;1078;443  >  61541 [ACK] Seq=791 Ack=1 Win=75 Len=1024 [TCP segment of a reassembled PDU];;0,571005;0,571128;0,000123;;9E-06;0,000114;0,000105
15;0,571128;192,168,100,21;162.159.130.234;TCP;54;61541  >  443 [ACK] Seq=55 Ack=1815 Win=514 Len=0;;0,571128;0,571242;0,000114;;0,000109;5E-06;-0,000104
16;0,571242;162.159.130.234;192,168,100,21;TCP;1078;443  >  61541 [ACK] Seq=1815 Ack=1 Win=75 Len=1024 [TCP segment of a reassembled PDU];;0,571242;0,571247;5E-06;;-5,6E-05;6,1E-05;0,000117
17;0,571247;162.159.130.234;192,168,100,21;TCP;1078;443  >  61541 [ACK] Seq=2839 Ack=1 Win=75 Len=1024 [TCP segment of a reassembled PDU];;0,571247;0,571308;6,1E-05;;-0,018214;0,018275;0,036489
18;0,571308;192,168,100,21;162.159.130.234;TCP;54;61541  >  443 [ACK] Seq=55 Ack=3863 Win=514 Len=0;;0,571308;0,589583;0,018275;;0,017576;0,000699;-0,016877
19;0,589583;192,168,100,21;157,240,218,60;TCP;93;[TCP Retransmission] 62415  >  443 [PSH, ACK] Seq=1 Ack=1 Win=514 Len=39;;0,589583;0,590282;0,000699;;0,000551;0,000148;-0,000403
20;0,590282;162.159.130.234;192,168,100,21;TLSv1,2;76;Application Data;;0,590282;0,59043;0,000148;;-0,137655;0,137803;0,275458
21;0,59043;192,168,100,21;162.159.130.234;TCP;54;61541  >  443 [ACK] Seq=55 Ack=3884 Win=513 Len=0;;0,59043;0,728233;0,137803;;-0,030666;0,168469;0,199135
22;0,728233;192,168,100,21;162.159.130.234;TCP;108;[TCP Retransmission] 61541  >  443 [PSH, ACK] Seq=1 Ack=3884 Win=513 Len=54;;0,728233;0,896702;0,168469;;0,03091;0,137559;0,106649
24;0,896702;192,168,100,21;157,240,218,60;TCP;93;[TCP Retransmission] 62415  >  443 [PSH, ACK] Seq=1 Ack=1 Win=514 Len=39;;0,896702;1,03426;0,137559;;0,122424;0,015135;-0,107289
26;1,03426;192,168,100,21;162.159.130.234;TCP;108;[TCP Retransmission] 61541  >  443 [PSH, ACK] Seq=1 Ack=3884 Win=513 Len=54;;1,03426;1,04940;0,015135;;0,015129;6E-06;-0,015123
27;1,04940;157,240,218,60;192,168,100,21;TCP;56;443  >  62415 [ACK] Seq=1 Ack=40 Win=265 Len=0;;1,04940;1,04940;6E-06;;-0,046455;0,046461;0,092916
28;1,04940;157,240,218,60;192,168,100,21;TLSv1,2;96;Application Data;;1,04940;1,09586;0,046461;;0,042445;0,004016;-0,038429
29;1,09586;192,168,100,21;157,240,218,60;TCP;54;62415  >  443 [ACK] Seq=40 Ack=40 Win=514 Len=0;;1,09586;1,09988;0,004016;;0,00401;6E-06;-0,004004
30;1,09988;157,240,218,60;192,168,100,21;TCP;56;[TCP Dup ACK 27#1] 443  >  62415 [ACK] Seq=40 Ack=40 Win=265 Len=0;;1,09988;1,09989;6E-06;;4E-06;2E-06;-2E-06
31;1,09989;162.159.130.234;192,168,100,21;TCP;56;443  >  61541 [ACK] Seq=3884 Ack=55 Win=75 Len=0;;1,09989;1,09989;2E-06;;-0,174548;0,17455;0,349098
32;1,09989;162.159.130.234;192,168,100,21;TCP;68;[TCP Dup ACK 31#1] 443  >  61541 [ACK] Seq=3884 Ack=55 Win=75 Len=0 SLE=1 SRE=55;;1,09989;1,27444;0,17455;;0,10685;0,0677;-0,03915
33;1,27444;157,240,218,60;192,168,100,21;TCP;56;[TCP Dup ACK 27#2] 443  >  62415 [ACK] Seq=40 Ack=40 Win=265 Len=0;;1,27444;1,34214;0,0677;;-0,030732;0,098432;0,129164
34;1,34214;192,168,100,21;50,116,58,41;TLSv1,2;82;Application Data;;1,34214;1,44057;0,098432;;0,098203;0,000229;-0,097974
35;1,44057;162.159.130.234;192,168,100,21;TLSv1,2;101;Application Data;;1,44057;1,44080;0,000229;;0,000226;3E-06;-0,000223
37;1,44080;162.159.130.234;192,168,100,21;TCP;68;[TCP Dup ACK 31#2] 443  >  61541 [ACK] Seq=3931 Ack=55 Win=75 Len=0 SLE=1 SRE=55;;1,44080;1,44080;3E-06;;-4,3E-05;4,6E-05;8,9E-05
38;1,44080;157,240,218,60;192,168,100,21;TCP;96;[TCP Spurious Retransmission] 443  >  62415 [PSH, ACK] Seq=1 Ack=40 Win=265 Len=39;;1,44080;1,44085;4,6E-05;;-0,05446;0,054506;0,108966
39;1,44085;192,168,100,21;157,240,218,60;TCP;66;[TCP Dup ACK 29#1] 62415  >  443 [ACK] Seq=40 Ack=40 Win=514 Len=0 SLE=1 SRE=40;;1,44085;1,49535;0,054506;;-0,589861;0,644367;1,234228
40;1,49535;192,168,100,21;162.159.130.234;TCP;54;61541  >  443 [ACK] Seq=55 Ack=3931 Win=513 Len=0;;1,49535;2,13972;0,644367;;0,64436;7E-06;-0,644353
43;2,13972;50,116,58,41;192,168,100,21;TCP;56;8443  >  51145 [ACK] Seq=1 Ack=29 Win=165 Len=0;;2,13972;2,13973;7E-06;;-0,05442;0,054427;0,108847
44;2,13973;50,116,58,41;192,168,100,21;TLSv1,2;80;Application Data;;2,13973;2,19415;0,054427;;-0,576647;0,631074;1,207721
45;2,19415;192,168,100,21;50,116,58,41;TCP;54;51145  >  8443 [ACK] Seq=29 Ack=25 Win=509 Len=0;;2,19415;2,82523;0,631074;;0,574524;0,05655;-0,517974
46;2,82523;192,168,100,21;18.213.208.247;TLSv1,2;90;Application Data;;2,82523;2,88178;0,05655;;0,004457;0,052093;0,047636
47;2,88178;162.159.130.234;192,168,100,21;TLSv1,2;284;Application Data;;2,88178;2,93387;0,052093;;-0,081459;0,133552;0,215011
48;2,93387;192,168,100,21;162.159.130.234;TCP;54;61541  >  443 [ACK] Seq=55 Ack=4161 Win=512 Len=0;;2,93387;3,06742;0,133552;;0,133476;7,6E-05;-0,1334
49;3,06742;50,116,58,41;192,168,100,21;TCP;80;[TCP Spurious Retransmission] 8443  >  51145 [PSH, ACK] Seq=1 Ack=29 Win=165 Len=24;;3,06742;3,06750;7,6E-05;;-0,068482;0,068558;0,13704
50;3,06750;192,168,100,21;50,116,58,41;TCP;66;[TCP Dup ACK 45#1] 51145  >  8443 [ACK] Seq=29 Ack=25 Win=509 Len=0 SLE=1 SRE=25;;3,06750;3,13606;0,068558;;-0,24311;0,311668;0,554778
51;3,13606;192,168,100,21;18.213.208.247;TCP;90;[TCP Retransmission] 62377  >  443 [PSH, ACK] Seq=1 Ack=1 Win=510 Len=36;;3,13606;3,44773;0,311668;;0,277673;0,033995;-0,243678
52;3,44773;192,168,100,21;18.213.208.247;TCP;90;[TCP Retransmission] 62377  >  443 [PSH, ACK] Seq=1 Ack=1 Win=510 Len=36;;3,44773;3,48172;0,033995;;-0,009513;0,043508;0,053021
53;3,48172;162.159.130.234;192,168,100,21;TLSv1,2;292;Application Data;;3,48172;3,52523;0,043508;;-0,125574;0,169082;0,294656
54;3,52523;192,168,100,21;162.159.130.234;TCP;54;61541  >  443 [ACK] Seq=55 Ack=4399 Win=511 Len=0;;3,52523;3,69431;0,169082;;0,117373;0,051709;-0,065664
55;3,69431;162.159.130.234;192,168,100,21;TLSv1,2;352;Application Data;;3,69431;3,74602;0,051709;;-0,257616;0,309325;0,566941
56;3,74602;192,168,100,21;162.159.130.234;TCP;54;61541  >  443 [ACK] Seq=55 Ack=4697 Win=510 Len=0;;3,74602;4,05534;0,309325;;0,129239;0,180086;0,050847
57;4,05534;192,168,100,21;18.213.208.247;TCP;90;[TCP Retransmission] 62377  >  443 [PSH, ACK] Seq=1 Ack=1 Win=510 Len=36;;4,05534;4,23543;0,180086;;0,180024;6,2E-05;-0,179962
58;4,23543;162.159.130.234;192,168,100,21;TCP;352;[TCP Spurious Retransmission] 443  >  61541 [PSH, ACK] Seq=4399 Ack=55 Win=75 Len=298;;4,23543;4,23549;6,2E-05;;-0,517599;0,517661;1,03526
59;4,23549;192,168,100,21;162.159.130.234;TCP;66;[TCP Dup ACK 56#1] 61541  >  443 [ACK] Seq=55 Ack=4697 Win=510 Len=0 SLE=4399 SRE=4697;;4,23549;4,75315;0,517661;;0,465112;0,052549;-0,412563
60;4,75315;162.159.130.234;192,168,100,21;TLSv1,2;154;Application Data;;4,75315;4,80570;0,052549;;-0,3974;0,449949;0,847349
61;4,80570;192,168,100,21;162.159.130.234;TCP;54;61541  >  443 [ACK] Seq=55 Ack=4797 Win=510 Len=0;;4,80570;5,25565;0,449949;;0,062449;0,3875;0,325051
62;5,25565;192,168,100,21;18.213.208.247;TCP;90;[TCP Retransmission] 62377  >  443 [PSH, ACK] Seq=1 Ack=1 Win=510 Len=36;;5,25565;5,64315;0,3875;;0,387454;4,6E-05;-0,387408
63;5,64315;50,116,58,41;192,168,100,21;TCP;80;[TCP Spurious Retransmission] 8443  >  51145 [PSH, ACK] Seq=1 Ack=29 Win=165 Len=24;;5,64315;5,64320;4,6E-05;;-0,230938;0,230984;0,461922
64;5,64320;192,168,100,21;50,116,58,41;TCP;66;[TCP Dup ACK 45#2] 51145  >  8443 [ACK] Seq=29 Ack=25 Win=509 Len=0 SLE=1 SRE=25;;5,64320;5,87418;0,230984;;0,230936;4,8E-05;-0,230888
67;5,87418;162.159.130.234;192,168,100,21;TCP;920;[TCP Spurious Retransmission] 443  >  61541 [PSH, ACK] Seq=3931 Ack=55 Win=75 Len=866;;5,87418;5,87423;4,8E-05;;-1,501057;1,501105;3,002162
68;5,87423;192,168,100,21;162.159.130.234;TCP;66;[TCP Dup ACK 61#1] 61541  >  443 [ACK] Seq=55 Ack=4797 Win=510 Len=0 SLE=3931 SRE=4797;;5,87423;7,37533;1,501105;;1,488726;0,012379;-1,476347
73;7,37533;162.159.130.234;192,168,100,21;TLSv1,2;343;Application Data, Application Data;;7,37533;7,38771;0,012379;;0,012374;5E-06;-0,012369
74;7,38771;18.213.208.247;192,168,100,21;TCP;56;443  >  62377 [ACK] Seq=1 Ack=37 Win=143 Len=0;;7,38771;7,38772;5E-06;;4E-06;1E-06;-3E-06
75;7,38772;18.213.208.247;192,168,100,21;TCP;68;[TCP Dup ACK 74#1] 443  >  62377 [ACK] Seq=1 Ack=37 Win=143 Len=0 SLE=1 SRE=37;;7,38772;7,38772;1E-06;;-0,04263;0,042631;0,085261
76;7,38772;18.213.208.247;192,168,100,21;TCP;68;[TCP Dup ACK 74#2] 443  >  62377 [ACK] Seq=1 Ack=37 Win=143 Len=0 SLE=1 SRE=37;;7,38772;7,43035;0,042631;;-0,225222;0,267853;0,493075
77;7,43035;192,168,100,21;162.159.130.234;TCP;54;61541  >  443 [ACK] Seq=55 Ack=5086 Win=509 Len=0;;7,43035;7,69820;0,267853;;-0,649635;0,917488;1,567123
78;7,69820;18.213.208.247;192,168,100,21;TCP;68;[TCP Dup ACK 74#3] 443  >  62377 [ACK] Seq=1 Ack=37 Win=143 Len=0 SLE=1 SRE=37;;7,69820;8,61569;0,917488;;0,871328;0,04616;-0,825168
90;8,61569;162.159.130.234;192,168,100,21;TLSv1,2;142;Application Data;;8,61569;8,66185;0,04616;;-0,14363;0,18979;0,33342
91;8,66185;192,168,100,21;162.159.130.234;TCP;54;61541  >  443 [ACK] Seq=55 Ack=5174 Win=508 Len=0;;8,66185;8,85164;0,18979;;-0,328575;0,518365;0,84694
94;8,85164;192,168,100,21;74.125.200.188;TCP;55;50935  >  5228 [ACK] Seq=1 Ack=1 Win=509 Len=1;;8,85164;9,37001;0,518365;;0,070873;0,447492;0,376619
98;9,37001;18.213.208.247;192,168,100,21;TCP;68;[TCP Dup ACK 74#4] 443  >  62377 [ACK] Seq=1 Ack=37 Win=143 Len=0 SLE=1 SRE=37;;9,37001;9,81750;0,447492;;0,40386;0,043632;-0,360228
104;9,81750;162.159.130.234;192,168,100,21;TLSv1,2;337;Application Data;;9,81750;9,86113;0,043632;;-1,077468;1,1211;2,198568
106;9,86113;192,168,100,21;162.159.130.234;TCP;54;61541  >  443 [ACK] Seq=55 Ack=5457 Win=514 Len=0;;9,86113;10,98223;1,1211;;1,120989;0,000111;-1,120878
116;10,98223;162.159.130.234;192,168,100,21;TLSv1,2;373;[TCP Previous segment not captured] , Application Data, Application Data;;10,98223;10,98234;0,000111;;-3,548813;3,548924;7,097737
117;10,98234;192,168,100,21;162.159.130.234;TCP;66;[TCP Dup ACK 106#1] 61541  >  443 [ACK] Seq=55 Ack=5457 Win=514 Len=0 SLE=5583 SRE=5902;;10,98234;14,53127;3,548924;;3,548838;8,6E-05;-3,548752
128;14,53127;162.159.130.234;192,168,100,21;TLSv1,2;474;[TCP Previous segment not captured] , Application Data;;14,53127;14,53135;8,6E-05;;-1,191016;1,191102;2,382118
129;14,53135;192,168,100,21;162.159.130.234;TCP;74;[TCP Dup ACK 106#2] 61541  >  443 [ACK] Seq=55 Ack=5457 Win=514 Len=0 SLE=6007 SRE=6427 SLE=5583 SRE=5902;;14,53135;15,72245;1,191102;;1,191031;7,1E-05;-1,19096
134;15,72245;162.159.130.234;192,168,100,21;TLSv1,2;178;[TCP Previous segment not captured] , Application Data;;15,72245;15,72252;7,1E-05;;-0,104864;0,104935;0,209799
135;15,72252;192,168,100,21;162.159.130.234;TCP;82;[TCP Dup ACK 106#3] 61541  >  443 [ACK] Seq=55 Ack=5457 Win=514 Len=0 SLE=6637 SRE=6761 SLE=6007 SRE=6427 SLE=5583 SRE=5902;;15,72252;15,82746;0,104935;;0,104865;7E-05;-0,104795
136;15,82746;162.159.130.234;192,168,100,21;TLSv1,2;154;Application Data;;15,82746;15,82753;7E-05;;-0,088002;0,088072;0,176074
137;15,82753;192,168,100,21;162.159.130.234;TCP;82;[TCP Dup ACK 106#4] 61541  >  443 [ACK] Seq=55 Ack=5457 Win=514 Len=0 SLE=6637 SRE=6861 SLE=6007 SRE=6427 SLE=5583 SRE=5902;;15,82753;15,91560;0,088072;;0,088006;6,6E-05;-0,08794
139;15,91560;162.159.130.234;192,168,100,21;TLSv1,2;172;Application Data;;15,91560;15,91567;6,6E-05;;-0,138528;0,138594;0,277122
140;15,91567;192,168,100,21;162.159.130.234;TCP;82;[TCP Dup ACK 106#5] 61541  >  443 [ACK] Seq=55 Ack=5457 Win=514 Len=0 SLE=6637 SRE=6979 SLE=6007 SRE=6427 SLE=5583 SRE=5902;;15,91567;16,05426;0,138594;;-0,159493;0,298087;0,45758
141;16,05426;192,168,100,21;44.194.132.209;TLSv1,2;317;Application Data;;16,05426;16,35235;0,298087;;0,282811;0,015276;-0,267535
142;16,35235;192,168,100,21;50,116,58,41;TLSv1,2;82;Application Data;;16,35235;16,36762;0,015276;;-0,297267;0,312543;0,60981
143;16,36762;192,168,100,21;44.194.132.209;TCP;317;[TCP Retransmission] 62381  >  443 [PSH, ACK] Seq=1 Ack=1 Win=511 Len=263;;16,36762;16,68017;0,312543;;-0,102887;0,41543;0,518317
144;16,68017;192,168,100,21;44.194.132.209;TCP;317;[TCP Retransmission] 62381  >  443 [PSH, ACK] Seq=1 Ack=1 Win=511 Len=263;;16,68017;17,09560;0,41543;;0,228539;0,186891;-0,041648
145;17,09560;192,168,100,21;50,116,58,41;TCP;82;[TCP Retransmission] 51145  >  8443 [PSH, ACK] Seq=29 Ack=25 Win=509 Len=28;;17,09560;17,28249;0,186891;;-0,514097;0,700988;1,215085
146;17,28249;192,168,100,21;44.194.132.209;TCP;317;[TCP Retransmission] 62381  >  443 [PSH, ACK] Seq=1 Ack=1 Win=511 Len=263;;17,28249;17,98348;0,700988;;0,317372;0,383616;0,066244
155;17,98348;192,168,100,21;50,116,58,41;TCP;82;[TCP Retransmission] 51145  >  8443 [PSH, ACK] Seq=29 Ack=25 Win=509 Len=28;;17,98348;18,36709;0,383616;;0,258653;0,124963;-0,13369
157;18,36709;192,168,100,21;20,197,71,89;TLSv1,2;98;Application Data;;18,36709;18,49206;0,124963;;-0,032583;0,157546;0,190129
163;18,49206;192,168,100,21;44.194.132.209;TCP;317;[TCP Retransmission] 62381  >  443 [PSH, ACK] Seq=1 Ack=1 Win=511 Len=263;;18,49206;18,64960;0,157546;;-0,156952;0,314498;0,47145
164;18,64960;192,168,100,21;20,197,71,89;TCP;98;[TCP Retransmission] 62308  >  443 [PSH, ACK] Seq=1 Ack=1 Win=510 Len=44;;18,64960;18,96410;0,314498;;0,17519;0,139308;-0,035882
167;18,96410;192,168,100,21;20,197,71,89;TCP;98;[TCP Retransmission] 62308  >  443 [PSH, ACK] Seq=1 Ack=1 Win=510 Len=44;;18,96410;19,10341;0,139308;;-0,005341;0,144649;0,14999
169;19,10341;192,168,100,21;157,240,217,60;TLSv1,2;94;Application Data;;19,10341;19,24806;0,144649;;-0,17837;0,323019;0,501389
173;19,24806;74.125.200.188;192,168,100,21;TCP;68;5228  >  50935 [ACK] Seq=1 Ack=2 Win=265 Len=0 SLE=1 SRE=2;;19,24806;19,57108;0,323019;;0,139551;0,183468;0,043917
176;19,57108;192,168,100,21;20,197,71,89;TCP;98;[TCP Retransmission] 62308  >  443 [PSH, ACK] Seq=1 Ack=1 Win=510 Len=44;;19,57108;19,75454;0,183468;;-0,630797;0,814265;1,445062
179;19,75454;192,168,100,21;50,116,58,41;TCP;82;[TCP Retransmission] 51145  >  8443 [PSH, ACK] Seq=29 Ack=25 Win=509 Len=28;;19,75454;20,56881;0,814265;;0,813784;0,000481;-0,813303
187;20,56881;192,168,100,21;74.125.200.119;TLSv1,2;93;Application Data;;20,56881;20,56929;0,000481;;0,000395;8,6E-05;-0,000309
188;20,56929;192,168,100,21;74.125.200.119;TLSv1,2;78;Application Data;;20,56929;20,56938;8,6E-05;;-0,20212;0,202206;0,404326
189;20,56938;192,168,100,21;74.125.200.119;TCP;54;62203  >  443 [FIN, ACK] Seq=64 Ack=1 Win=4098 Len=0;;20,56938;20,77158;0,202206;;0,124434;0,077772;-0,046662
191;20,77158;192,168,100,21;20,197,71,89;TCP;98;[TCP Retransmission] 62308  >  443 [PSH, ACK] Seq=1 Ack=1 Win=510 Len=44;;20,77158;20,84935;0,077772;;0,030294;0,047478;0,017184
192;20,84935;192,168,100,21;74.125.200.119;TCP;117;[TCP Retransmission] 62203  >  443 [FIN, PSH, ACK] Seq=1 Ack=1 Win=4098 Len=63;;20,84935;20,89683;0,047478;;-0,217316;0,264794;0,48211
193;20,89683;192,168,100,21;44.194.132.209;TCP;317;[TCP Retransmission] 62381  >  443 [PSH, ACK] Seq=1 Ack=1 Win=511 Len=263;;20,89683;21,16163;0,264794;;-0,338593;0,603387;0,94198
194;21,16163;192,168,100,21;74.125.200.119;TCP;117;[TCP Retransmission] 62203  >  443 [FIN, PSH, ACK] Seq=1 Ack=1 Win=4098 Len=63;;21,16163;21,76501;0,603387;;0,385975;0,217412;-0,168563
195;21,76501;192,168,100,21;74.125.200.119;TCP;117;[TCP Retransmission] 62203  >  443 [FIN, PSH, ACK] Seq=1 Ack=1 Win=4098 Len=63;;21,76501;21,98242;0,217412;;0,19218;0,025232;-0,166948
197;21,98242;192,168,100,21;20,197,71,89;TCP;98;[TCP Retransmission] 62308  >  443 [PSH, ACK] Seq=1 Ack=1 Win=510 Len=44;;21,98242;22,00766;0,025232;;0,024833;0,000399;-0,024434
198;22,00766;192,99,44,195;192,168,100,21;TLSv1,2;80;Application Data;;22,00766;22,00806;0,000399;;-0,300932;0,301331;0,602263
199;22,00806;192,168,100,21;192,99,44,195;TLSv1,2;82;Application Data;;22,00806;22,30939;0,301331;;-0,010626;0,311957;0,322583
200;22,30939;192,168,100,21;192,99,44,195;TCP;82;[TCP Retransmission] 61628  >  443 [PSH, ACK] Seq=1 Ack=25 Win=512 Len=28;;22,30939;22,62134;0,311957;;-0,045369;0,357326;0,402695
201;22,62134;192,168,100,21;192,99,44,195;TCP;82;[TCP Retransmission] 61628  >  443 [PSH, ACK] Seq=1 Ack=25 Win=512 Len=28;;22,62134;22,97867;0,357326;;0,13837;0,218956;0,080586
204;22,97867;192,168,100,21;74.125.200.119;TCP;117;[TCP Retransmission] 62203  >  443 [FIN, PSH, ACK] Seq=1 Ack=1 Win=4098 Len=63;;22,97867;23,19763;0,218956;;0,18838;0,030576;-0,157804
207;23,19763;192,168,100,21;20,197,71,89;TCP;98;[TCP Retransmission] 62308  >  443 [PSH, ACK] Seq=1 Ack=1 Win=510 Len=44;;23,19763;23,22820;0,030576;;-0,044751;0,075327;0,120078
208;23,22820;192,168,100,21;192,99,44,195;TCP;82;[TCP Retransmission] 61628  >  443 [PSH, ACK] Seq=1 Ack=25 Win=512 Len=28;;23,22820;23,30353;0,075327;;-0,016993;0,09232;0,109313
209;23,30353;192,168,100,21;50,116,58,41;TCP;82;[TCP Retransmission] 51145  >  8443 [PSH, ACK] Seq=29 Ack=25 Win=509 Len=28;;23,30353;23,39585;0,09232;;-0,391367;0,483687;0,875054
210;23,39585;192,168,100,21;35,186,224,47;TLSv1,2;97;Application Data;;23,39585;23,87954;0,483687;;0,241404;0,242283;0,000879
211;23,87954;192,168,100,21;157,240,217,60;TCP;94;[TCP Retransmission] 62383  >  443 [PSH, ACK] Seq=1 Ack=1 Win=514 Len=40;;23,87954;24,12182;0,242283;;0,242279;4E-06;-0,242275
217;24,12182;162.159.130.234;192,168,100,21;TCP;1013;[TCP Retransmission] 443  >  61541 [PSH, ACK] Seq=5902 Ack=55 Win=75 Len=959;;24,12182;24,12182;4E-06;;2E-06;2E-06;-3,55271E-15
218;24,12182;162.159.130.234;192,168,100,21;TLSv1,2;1078;Application Data, Application Data, Application Data, Application Data, Application Data, Application Data, Application Data;;24,12182;24,12182;2E-06;;-4,6E-05;4,8E-05;9,4E-05
219;24,12182;162.159.130.234;192,168,100,21;TLSv1,2;708;Application Data, Application Data;;24,12182;24,12187;4,8E-05;;-2,7E-05;7,5E-05;0,000102
220;24,12187;192,168,100,21;162.159.130.234;TCP;74;[TCP Dup ACK 106#6] 61541  >  443 [ACK] Seq=55 Ack=5457 Win=514 Len=0 SLE=6007 SRE=6427 SLE=5583 SRE=6979;;24,12187;24,12195;7,5E-05;;3,7E-05;3,8E-05;1E-06
221;24,12195;192,168,100,21;162.159.130.234;TCP;66;[TCP Dup ACK 106#7] 61541  >  443 [ACK] Seq=55 Ack=5457 Win=514 Len=0 SLE=5583 SRE=8003;;24,12195;24,12199;3,8E-05;;-0,067364;0,067402;0,134766
222;24,12199;192,168,100,21;162.159.130.234;TCP;66;[TCP Dup ACK 106#8] 61541  >  443 [ACK] Seq=55 Ack=5457 Win=514 Len=0 SLE=5583 SRE=8657;;24,12199;24,18939;0,067402;;0,002704;0,064698;0,061994
228;24,18939;192,168,100,21;74.125.200.119;TCP;117;[TCP Retransmission] 62203  >  443 [FIN, PSH, ACK] Seq=1 Ack=1 Win=4098 Len=63;;24,18939;24,25409;0,064698;;0,064639;5,9E-05;-0,06458
229;24,25409;192,99,44,195;192,168,100,21;TCP;80;[TCP Spurious Retransmission] 443  >  61628 [PSH, ACK] Seq=1 Ack=1 Win=63983 Len=24;;24,25409;24,25414;5,9E-05;;-0,184192;0,184251;0,368443
230;24,25414;192,168,100,21;192,99,44,195;TCP;66;[TCP Dup ACK 199#1] 61628  >  443 [ACK] Seq=29 Ack=25 Win=512 Len=0 SLE=1 SRE=25;;24,25414;24,43840;0,184251;;-0,078758;0,263009;0,341767
236;24,43840;192,168,100,21;192,99,44,195;TCP;82;[TCP Retransmission] 61628  >  443 [PSH, ACK] Seq=1 Ack=25 Win=512 Len=28;;24,43840;24,70140;0,263009;;0,262923;8,6E-05;-0,262837
238;24,70140;162.159.130.234;192,168,100,21;TLSv1,2;246;Application Data;;24,70140;24,70149;8,6E-05;;-0,103005;0,103091;0,206096
240;24,70149;192,168,100,21;162.159.130.234;TCP;66;[TCP Dup ACK 106#9] 61541  >  443 [ACK] Seq=55 Ack=5457 Win=514 Len=0 SLE=5583 SRE=8849;;24,70149;24,80458;0,103091;;0,103086;5E-06;-0,103081
241;24,80458;162.159.130.234;192,168,100,21;TLSv1,2;161;Application Data;;24,80458;24,80459;5E-06;;-6,1E-05;6,6E-05;0,000127
242;24,80459;44.194.132.209;192,168,100,21;TLSv1,2;88;Application Data;;24,80459;24,80465;6,6E-05;;-0,000261;0,000327;0,000588
243;24,80465;192,168,100,21;162.159.130.234;TCP;66;[TCP Dup ACK 106#10] 61541  >  443 [ACK] Seq=55 Ack=5457 Win=514 Len=0 SLE=5583 SRE=8956;;24,80465;24,80498;0,000327;;0,000323;4E-06;-0,000319
244;24,80498;44.194.132.209;192,168,100,21;TLSv1,2;301;Application Data;;24,80498;24,80498;4E-06;;-1E-06;5E-06;6E-06
245;24,80498;44.194.132.209;192,168,100,21;TCP;68;[TCP Dup ACK 242#1] 443  >  62381 [ACK] Seq=281 Ack=264 Win=767 Len=0 SLE=1 SRE=264;;24,80498;24,80499;5E-06;;3E-06;2E-06;-1E-06
248;24,80499;50,116,58,41;192,168,100,21;TCP;56;[TCP Previous segment not captured] 8443  >  51145 [ACK] Seq=49 Ack=57 Win=165 Len=0;;24,80499;24,80499;2E-06;;0;2E-06;2E-06
249;24,80499;20,197,71,89;192,168,100,21;TLSv1,2;229;Application Data;;24,80499;24,80499;2E-06;;-3,55271E-15;2E-06;2E-06
251;24,80499;20,197,71,89;192,168,100,21;TCP;68;[TCP Dup ACK 249#1] 443  >  62308 [ACK] Seq=176 Ack=45 Win=7048 Len=0 SLE=1 SRE=45;;24,80499;24,80499;2E-06;;1E-06;1E-06;0
253;24,80499;20,197,71,89;192,168,100,21;TCP;68;[TCP Dup ACK 249#2] 443  >  62308 [ACK] Seq=176 Ack=45 Win=7048 Len=0 SLE=1 SRE=45;;24,80499;24,80500;1E-06;;-3E-06;4E-06;7E-06
254;24,80500;20,197,71,89;192,168,100,21;TCP;68;[TCP Dup ACK 249#3] 443  >  62308 [ACK] Seq=176 Ack=45 Win=7048 Len=0 SLE=1 SRE=45;;24,80500;24,80500;4E-06;;2E-06;2E-06;7,10543E-15
258;24,80500;74.125.200.119;192,168,100,21;TCP;56;443  >  62203 [ACK] Seq=1 Ack=65 Win=470 Len=0;;24,80500;24,80500;2E-06;;1E-06;1E-06;0
259;24,80500;74.125.200.119;192,168,100,21;TCP;68;443  >  62203 [ACK] Seq=1 Ack=40 Win=470 Len=0 SLE=64 SRE=65;;24,80500;24,80500;1E-06;;-7,8E-05;7,9E-05;0,000157
260;24,80500;74.125.200.119;192,168,100,21;TCP;56;443  >  62203 [FIN, ACK] Seq=1 Ack=65 Win=470 Len=0;;24,80500;24,80508;7,9E-05;;-0,000649;0,000728;0,001377
261;24,80508;192,168,100,21;44.194.132.209;TCP;54;62381  >  443 [ACK] Seq=264 Ack=281 Win=510 Len=0;;24,80508;24,80581;0,000728;;0,000393;0,000335;-5,8E-05
262;24,80581;192,168,100,21;74.125.200.119;TCP;54;62203  >  443 [ACK] Seq=65 Ack=2 Win=4098 Len=0;;24,80581;24,80614;0,000335;;0,000329;6E-06;-0,000323
263;24,80614;44.194.132.209;192,168,100,21;TCP;301;[TCP Spurious Retransmission] 443  >  62381 [PSH, ACK] Seq=34 Ack=264 Win=767 Len=247;;24,80614;24,80615;6E-06;;4E-06;2E-06;-2E-06
265;24,80615;50,116,58,41;192,168,100,21;TCP;68;[TCP Dup ACK 248#1] 8443  >  51145 [ACK] Seq=49 Ack=57 Win=165 Len=0 SLE=29 SRE=57;;24,80615;24,80615;2E-06;;1E-06;1E-06;-7,10543E-15
266;24,80615;20,197,71,89;192,168,100,21;TCP;68;[TCP Dup ACK 249#4] 443  >  62308 [ACK] Seq=176 Ack=45 Win=7048 Len=0 SLE=1 SRE=45;;24,80615;24,80615;1E-06;;-3,55271E-15;1E-06;1E-06
267;24,80615;44.194.132.209;192,168,100,21;TCP;68;[TCP Dup ACK 242#2] 443  >  62381 [ACK] Seq=281 Ack=264 Win=767 Len=0 SLE=1 SRE=264;;24,80615;24,80615;1E-06;;-1E-06;2E-06;3E-06
268;24,80615;74.125.200.119;192,168,100,21;TCP;68;[TCP Dup ACK 260#1] 443  >  62203 [ACK] Seq=2 Ack=65 Win=470 Len=0 SLE=1 SRE=65;;24,80615;24,80616;2E-06;;1E-06;1E-06;-7,10543E-15
269;24,80616;20,197,71,89;192,168,100,21;TCP;229;[TCP Retransmission] 443  >  62308 [PSH, ACK] Seq=1 Ack=45 Win=7048 Len=175;;24,80616;24,80616;1E-06;;-1E-06;2E-06;3E-06
270;24,80616;50,116,58,41;192,168,100,21;TCP;68;[TCP Dup ACK 248#2] 8443  >  51145 [ACK] Seq=49 Ack=57 Win=165 Len=0 SLE=29 SRE=57;;24,80616;24,80616;2E-06;;1E-06;1E-06;-7,10543E-15
271;24,80616;74.125.200.119;192,168,100,21;TCP;68;[TCP Dup ACK 260#2] 443  >  62203 [ACK] Seq=2 Ack=65 Win=470 Len=0 SLE=1 SRE=65;;24,80616;24,80616;1E-06;;-3,55271E-15;1E-06;1E-06
272;24,80616;74.125.200.119;192,168,100,21;TCP;68;[TCP Dup ACK 260#3] 443  >  62203 [ACK] Seq=2 Ack=65 Win=470 Len=0 SLE=1 SRE=65;;24,80616;24,80616;1E-06;;-1E-06;2E-06;3E-06
273;24,80616;20,197,71,89;192,168,100,21;TCP;68;[TCP Dup ACK 249#5] 443  >  62308 [ACK] Seq=176 Ack=45 Win=7048 Len=0 SLE=1 SRE=45;;24,80616;24,80616;2E-06;;1E-06;1E-06;-7,10543E-15
274;24,80616;74.125.200.119;192,168,100,21;TCP;56;[TCP Out-Of-Order] 443  >  62203 [FIN, ACK] Seq=1 Ack=65 Win=470 Len=0;;24,80616;24,80616;1E-06;;-8,8E-05;8,9E-05;0,000177
275;24,80616;44.194.132.209;192,168,100,21;TCP;68;[TCP Dup ACK 242#3] 443  >  62381 [ACK] Seq=281 Ack=264 Win=767 Len=0 SLE=1 SRE=264;;24,80616;24,80625;8,9E-05;;-3,2E-05;0,000121;0,000153
276;24,80625;192,168,100,21;44.194.132.209;TCP;66;[TCP Dup ACK 261#1] 62381  >  443 [ACK] Seq=264 Ack=281 Win=510 Len=0 SLE=34 SRE=281;;24,80625;24,80637;0,000121;;2,2E-05;9,9E-05;7,7E-05
277;24,80637;192,168,100,21;20,197,71,89;TCP;66;62308  >  443 [ACK] Seq=45 Ack=176 Win=509 Len=0 SLE=1 SRE=176;;24,80637;24,80647;9,9E-05;;-0,155961;0,15606;0,312021
278;24,80647;192,168,100,21;74.125.200.119;TCP;54;[TCP ZeroWindow] 62203  >  443 [ACK] Seq=65 Ack=2 Win=0 Len=0;;24,80647;24,96253;0,15606;;0,156055;5E-06;-0,15605
282;24,96253;20,197,71,89;192,168,100,21;TCP;229;[TCP Spurious Retransmission] 443  >  62308 [PSH, ACK] Seq=1 Ack=45 Win=7048 Len=175;;24,96253;24,96254;5E-06;;-4,6E-05;5,1E-05;9,7E-05
283;24,96254;192,99,44,195;192,168,100,21;TCP;56;443  >  61628 [ACK] Seq=25 Ack=29 Win=63983 Len=0;;24,96254;24,96259;5,1E-05;;-9,9E-05;0,00015;0,000249
284;24,96259;192,168,100,21;20,197,71,89;TCP;66;[TCP Dup ACK 277#1] 62308  >  443 [ACK] Seq=45 Ack=176 Win=509 Len=0 SLE=1 SRE=176;;24,96259;24,96274;0,00015;;0,000149;1E-06;-0,000148
286;24,96274;44.194.132.209;192,168,100,21;TCP;334;[TCP Spurious Retransmission] 443  >  62381 [PSH, ACK] Seq=1 Ack=264 Win=767 Len=280;;24,96274;24,96274;1E-06;;0;1E-06;1E-06
287;24,96274;74.125.200.119;192,168,100,21;TCP;56;[TCP Retransmission] 443  >  62203 [FIN, ACK] Seq=1 Ack=65 Win=470 Len=0;;24,96274;24,96274;1E-06;;-6,6E-05;6,7E-05;0,000133
288;24,96274;20,197,71,89;192,168,100,21;TCP;229;[TCP Spurious Retransmission] 443  >  62308 [PSH, ACK] Seq=1 Ack=45 Win=7048 Len=175;;24,96274;24,96281;6,7E-05;;1,5E-05;5,2E-05;3,7E-05
289;24,96281;192,168,100,21;44.194.132.209;TCP;66;[TCP Dup ACK 261#2] 62381  >  443 [ACK] Seq=264 Ack=281 Win=510 Len=0 SLE=1 SRE=281;;24,96281;24,96286;5,2E-05;;1E-05;4,2E-05;3,2E-05
290;24,96286;192,168,100,21;74.125.200.119;TCP;54;[TCP ZeroWindow] 62203  >  443 [ACK] Seq=65 Ack=2 Win=0 Len=0;;24,96286;24,96290;4,2E-05;;-0,218295;0,218337;0,436632
291;24,96290;192,168,100,21;20,197,71,89;TCP;66;[TCP Dup ACK 277#2] 62308  >  443 [ACK] Seq=45 Ack=176 Win=509 Len=0 SLE=1 SRE=176;;24,96290;25,18124;0,218337;;0,218276;6,1E-05;-0,218215
292;25,18124;74.125.200.119;192,168,100,21;TCP;56;[TCP Retransmission] 443  >  62203 [FIN, ACK] Seq=1 Ack=65 Win=470 Len=0;;25,18124;25,18130;6,1E-05;;-0,142623;0,142684;0,285307
293;25,18130;192,168,100,21;74.125.200.119;TCP;54;[TCP ZeroWindow] 62203  >  443 [ACK] Seq=65 Ack=2 Win=0 Len=0;;25,18130;25,32398;0,142684;;0,142678;6E-06;-0,142672
294;25,32398;44.194.132.209;192,168,100,21;TCP;334;[TCP Spurious Retransmission] 443  >  62381 [PSH, ACK] Seq=1 Ack=264 Win=767 Len=280;;25,32398;25,32399;6E-06;;-5,2E-05;5,8E-05;0,00011
295;25,32399;162.159.130.234;192,168,100,21;TLSv1,2;480;Application Data;;25,32399;25,32405;5,8E-05;;-4,7E-05;0,000105;0,000152
296;25,32405;192,168,100,21;44.194.132.209;TCP;66;[TCP Dup ACK 261#3] 62381  >  443 [ACK] Seq=264 Ack=281 Win=510 Len=0 SLE=1 SRE=281;;25,32405;25,32415;0,000105;;-2,009564;2,009669;4,019233
297;25,32415;192,168,100,21;162.159.130.234;TCP;66;[TCP Dup ACK 106#11] 61541  >  443 [ACK] Seq=55 Ack=5457 Win=514 Len=0 SLE=5583 SRE=9382;;25,32415;27,33382;2,009669;;2,009607;6,2E-05;-2,009545
302;27,33382;44.194.132.209;192,168,100,21;TCP;334;[TCP Spurious Retransmission] 443  >  62381 [PSH, ACK] Seq=1 Ack=264 Win=767 Len=280;;27,33382;27,33388;6,2E-05;;-0,598243;0,598305;1,196548
303;27,33388;192,168,100,21;44.194.132.209;TCP;66;[TCP Dup ACK 261#4] 62381  >  443 [ACK] Seq=264 Ack=281 Win=510 Len=0 SLE=1 SRE=281;;27,33388;27,93219;0,598305;;0,365806;0,232499;-0,133307
305;27,93219;192,99,44,195;192,168,100,21;TCP;68;[TCP Dup ACK 283#1] 443  >  61628 [ACK] Seq=25 Ack=29 Win=63983 Len=0 SLE=1 SRE=29;;27,93219;28,16469;0,232499;;-0,072842;0,305341;0,378183
306;28,16469;192,168,100,21;35,186,224,47;TCP;97;[TCP Retransmission] 51207  >  443 [PSH, ACK] Seq=1 Ack=1 Win=509 Len=43;;28,16469;28,47003;0,305341;;0,305277;6,4E-05;-0,305213
307;28,47003;20,197,71,89;192,168,100,21;TCP;229;[TCP Spurious Retransmission] 443  >  62308 [PSH, ACK] Seq=1 Ack=45 Win=7048 Len=175;;28,47003;28,47009;6,4E-05;;-0,10652;0,106584;0,213104
308;28,47009;192,168,100,21;20,197,71,89;TCP;66;[TCP Dup ACK 277#3] 62308  >  443 [ACK] Seq=45 Ack=176 Win=509 Len=0 SLE=1 SRE=176;;28,47009;28,57668;0,106584;;0,071813;0,034771;-0,037042
309;28,57668;192,99,44,195;192,168,100,21;TCP;68;[TCP Dup ACK 283#2] 443  >  61628 [ACK] Seq=25 Ack=29 Win=63983 Len=0 SLE=1 SRE=29;;28,57668;28,61145;0,034771;;0,033015;0,001756;-0,031259
310;28,61145;35,186,224,47;192,168,100,21;TCP;56;443  >  51207 [ACK] Seq=1 Ack=44 Win=272 Len=0;;28,61145;28,61320;0,001756;;-0,000121;0,001877;0,001998
311;28,61320;74.125.200.119;192,168,100,21;TCP;68;[TCP Dup ACK 260#4] 443  >  62203 [ACK] Seq=2 Ack=65 Win=470 Len=0 SLE=1 SRE=65;;28,61320;28,61508;0,001877;;-0,011901;0,013778;0,025679
313;28,61508;192,168,100,21;142,251,85,71;TCP;66;62448  >  443 [SYN] Seq=0 Win=64240 Len=0 MSS=1460 WS=256 SACK_PERM=1;;28,61508;28,62886;0,013778;;-0,017833;0,031611;0,049444
315;28,62886;20,197,71,89;192,168,100,21;TCP;68;[TCP Dup ACK 249#6] 443  >  62308 [ACK] Seq=176 Ack=45 Win=7048 Len=0 SLE=1 SRE=45;;28,62886;28,66047;0,031611;;0,030661;0,00095;-0,029711
316;28,66047;157,240,217,60;192,168,100,21;TCP;56;443  >  62383 [ACK] Seq=1 Ack=41 Win=474 Len=0;;28,66047;28,66142;0,00095;;0,000947;3E-06;-0,000944
318;28,66142;74.125.200.119;192,168,100,21;TCP;68;[TCP Dup ACK 260#5] 443  >  62203 [ACK] Seq=2 Ack=65 Win=470 Len=0 SLE=1 SRE=65;;28,66142;28,66142;3E-06;;-0,046406;0,046409;0,092815
319;28,66142;162.159.130.234;192,168,100,21;TCP;180;[TCP Retransmission] 443  >  61541 [PSH, ACK] Seq=5457 Ack=55 Win=75 Len=126;;28,66142;28,70783;0,046409;;0,008556;0,037853;0,029297
321;28,70783;192,168,100,21;162.159.130.234;TCP;54;61541  >  443 [ACK] Seq=55 Ack=9382 Win=514 Len=0;;28,70783;28,74569;0,037853;;-0,015981;0,053834;0,069815
322;28,74569;35,186,224,47;192,168,100,21;TLSv1,2;96;Application Data;;28,74569;28,79952;0,053834;;-0,023112;0,076946;0,100058
325;28,79952;192,168,100,21;35,186,224,47;TCP;54;51207  >  443 [ACK] Seq=44 Ack=41 Win=508 Len=0;;28,79952;28,87647;0,076946;;0,07689;5,6E-05;-0,076834
327;28,87647;74.125.200.119;192,168,100,21;TCP;56;[TCP Retransmission] 443  >  62203 [FIN, ACK] Seq=1 Ack=65 Win=470 Len=0;;28,87647;28,87652;5,6E-05;;-0,000447;0,000503;0,00095
328;28,87652;192,168,100,21;74.125.200.119;TCP;54;[TCP ZeroWindow] 62203  >  443 [ACK] Seq=65 Ack=2 Win=0 Len=0;;28,87652;28,87702;0,000503;;-0,226895;0,227398;0,454293
329;28,87702;192,168,100,21;142,251,85,71;TCP;66;62449  >  443 [SYN] Seq=0 Win=64240 Len=0 MSS=1460 WS=256 SACK_PERM=1;;28,87702;29,10442;0,227398;;0,097603;0,129795;0,032192
333;29,10442;192,99,44,195;192,168,100,21;TCP;68;[TCP Dup ACK 283#3] 443  >  61628 [ACK] Seq=25 Ack=29 Win=63983 Len=0 SLE=1 SRE=29;;29,10442;29,23422;0,129795;;0,084558;0,045237;-0,039321
334;29,23422;157,240,217,60;192,168,100,21;TLSv1,2;101;Application Data;;29,23422;29,27945;0,045237;;0,044761;0,000476;-0,044285
335;29,27945;192,168,100,21;157,240,217,60;TCP;54;62383  >  443 [ACK] Seq=41 Ack=48 Win=514 Len=0;;29,27945;29,27993;0,000476;;0,000398;7,8E-05;-0,00032
336;29,27993;35,186,224,47;192,168,100,21;TCP;96;[TCP Spurious Retransmission] 443  >  51207 [PSH, ACK] Seq=1 Ack=44 Win=272 Len=40;;29,27993;29,28001;7,8E-05;;-0,055832;0,05591;0,111742
338;29,28001;192,168,100,21;35,186,224,47;TCP;66;[TCP Dup ACK 325#1] 51207  >  443 [ACK] Seq=44 Ack=41 Win=508 Len=0 SLE=1 SRE=41;;29,28001;29,33592;0,05591;;0,055847;6,3E-05;-0,055784
339;29,33592;157,240,217,60;192,168,100,21;TCP;101;[TCP Spurious Retransmission] 443  >  62383 [PSH, ACK] Seq=1 Ack=41 Win=474 Len=47;;29,33592;29,33598;6,3E-05;;-0,067364;0,067427;0,134791
340;29,33598;192,168,100,21;157,240,217,60;TCP;66;[TCP Dup ACK 335#1] 62383  >  443 [ACK] Seq=41 Ack=48 Win=514 Len=0 SLE=1 SRE=48;;29,33598;29,40341;0,067427;;-0,138343;0,20577;0,344113
341;29,40341;74.125.200.119;192,168,100,21;TCP;56;443  >  62203 [RST] Seq=2 Win=0 Len=0;;29,40341;29,60918;0,20577;;0,196909;0,008861;-0,188048
344;29,60918;35,186,224,47;192,168,100,21;TCP;68;[TCP Dup ACK 310#1] 443  >  51207 [ACK] Seq=41 Ack=44 Win=272 Len=0 SLE=1 SRE=44;;29,60918;29,61804;0,008861;;-0,066957;0,075818;0,142775
345;29,61804;192,168,100,21;142,251,85,71;TCP;66;[TCP Retransmission] [TCP Port numbers reused] 62448  >  443 [SYN] Seq=0 Win=64240 Len=0 MSS=1460 WS=256 SACK_PERM=1;;29,61804;29,69386;0,075818;;0,075751;6,7E-05;-0,075684
350;29,69386;157,240,217,60;192,168,100,21;TCP;101;[TCP Spurious Retransmission] 443  >  62383 [PSH, ACK] Seq=1 Ack=41 Win=474 Len=47;;29,69386;29,69392;6,7E-05;;-0,004067;0,004134;0,008201
351;29,69392;192,168,100,21;157,240,217,60;TCP;66;[TCP Dup ACK 335#2] 62383  >  443 [ACK] Seq=41 Ack=48 Win=514 Len=0 SLE=1 SRE=48;;29,69392;29,69806;0,004134;;0,003861;0,000273;-0,003588
353;29,69806;142,251,85,71;192,168,100,21;TCP;68;443  >  62448 [SYN, ACK] Seq=0 Ack=1 Win=65535 Len=0 MSS=1408 SACK_PERM=1 WS=256;;29,69806;29,69833;0,000273;;-0,035154;0,035427;0,070581
354;29,69833;192,168,100,21;142,251,85,71;TCP;54;62448  >  443 [ACK] Seq=1 Ack=1 Win=132352 Len=0;;29,69833;29,73376;0,035427;;0,029185;0,006242;-0,022943
355;29,73376;192,168,100,21;142,251,85,71;TLSv1,3;571;Client Hello;;29,73376;29,74000;0,006242;;-0,003671;0,009913;0,013584
357;29,74000;162.159.130.234;192,168,100,21;TLSv1,2;833;Application Data, Application Data, Application Data, Application Data, Application Data;;29,74000;29,74991;0,009913;;0,009908;5E-06;-0,009903
358;29,74991;142,251,85,71;192,168,100,21;TCP;68;443  >  62449 [SYN, ACK] Seq=0 Ack=1 Win=65535 Len=0 MSS=1408 SACK_PERM=1 WS=256;;29,74991;29,74992;5E-06;;-0,000202;0,000207;0,000409
359;29,74992;74.125.200.119;192,168,100,21;TCP;56;443  >  62203 [RST] Seq=2 Win=0 Len=0;;29,74992;29,75013;0,000207;;-0,026222;0,026429;0,052651
360;29,75013;192,168,100,21;142,251,85,71;TCP;54;62449  >  443 [ACK] Seq=1 Ack=1 Win=132352 Len=0;;29,75013;29,77655;0,026429;;0,016304;0,010125;-0,006179
361;29,77655;192,168,100,21;142,251,85,71;TLSv1,2;571;Client Hello;;29,77655;29,78668;0,010125;;-0,11464;0,124765;0,239405
362;29,78668;192,168,100,21;162.159.130.234;TCP;54;61541  >  443 [ACK] Seq=55 Ack=10161 Win=511 Len=0;;29,78668;29,91144;0,124765;;0,124447;0,000318;-0,124129
363;29,91144;50,116,58,41;192,168,100,21;TCP;80;[TCP Retransmission] 8443  >  51145 [PSH, ACK] Seq=25 Ack=57 Win=165 Len=24;;29,91144;29,91176;0,000318;;-0,005455;0,005773;0,011228
364;29,91176;192,168,100,21;50,116,58,41;TLSv1,2;82;Application Data;;29,91176;29,91754;0,005773;;0,00571;6,3E-05;-0,005647
365;29,91754;142,251,85,71;192,168,100,21;TCP;68;[TCP Retransmission] 443  >  62448 [SYN, ACK] Seq=0 Ack=1 Win=65535 Len=0 MSS=1408 SACK_PERM=1 WS=256;;29,91754;29,91760;6,3E-05;;-0,075882;0,075945;0,151827
366;29,91760;192,168,100,21;142,251,85,71;TCP;66;[TCP Dup ACK 354#1] 62448  >  443 [ACK] Seq=518 Ack=1 Win=132352 Len=0 SLE=0 SRE=1;;29,91760;29,99354;0,075945;;0,074062;0,001883;-0,072179
370;29,99354;142,251,85,71;192,168,100,21;TCP;56;443  >  62448 [ACK] Seq=1 Ack=518 Win=66816 Len=0;;29,99354;29,99543;0,001883;;0,001877;6E-06;-0,001871
371;29,99543;142,251,85,71;192,168,100,21;TLSv1,3;1462;Server Hello, Change Cipher Spec;;29,99543;29,99543;6E-06;;-0,000152;0,000158;0,00031
372;29,99543;142,251,85,71;192,168,100,21;TCP;1462;443  >  62448 [ACK] Seq=1409 Ack=518 Win=66816 Len=1408 [TCP segment of a reassembled PDU];;29,99543;29,99559;0,000158;;0,000153;5E-06;-0,000148
373;29,99559;142,251,85,71;192,168,100,21;TCP;1462;443  >  62448 [ACK] Seq=2817 Ack=518 Win=66816 Len=1408 [TCP segment of a reassembled PDU];;29,99559;29,99560;5E-06;;-0,000129;0,000134;0,000263
374;29,99560;142,251,85,71;192,168,100,21;TLSv1,3;1007;Application Data;;29,99560;29,99573;0,000134;;-0,044311;0,044445;0,088756
375;29,99573;192,168,100,21;142,251,85,71;TCP;54;62448  >  443 [ACK] Seq=518 Ack=5178 Win=132352 Len=0;;29,99573;30,04017;0,044445;;0,04444;5E-06;-0,044435
377;30,04017;142,251,85,71;192,168,100,21;TLSv1,2;1462;[TCP Previous segment not captured] , Ignored Unknown Record;;30,04017;30,04018;5E-06;;-6,1E-05;6,6E-05;0,000127
378;30,04018;142,251,85,71;192,168,100,21;TLSv1,2;1007;Ignored Unknown Record;;30,04018;30,04025;6,6E-05;;-6E-06;7,2E-05;7,8E-05
379;30,04025;192,168,100,21;142,251,85,71;TCP;66;[TCP Dup ACK 360#1] 62449  >  443 [ACK] Seq=518 Ack=1 Win=132352 Len=0 SLE=2817 SRE=4225;;30,04025;30,04032;7,2E-05;;-0,203472;0,203544;0,407016
380;30,04032;192,168,100,21;142,251,85,71;TCP;66;[TCP Dup ACK 360#2] 62449  >  443 [ACK] Seq=518 Ack=1 Win=132352 Len=0 SLE=2817 SRE=5178;;30,04032;30,24386;0,203544;;0,148991;0,054553;-0,094438
382;30,24386;162.159.130.234;192,168,100,21;TLSv1,2;200;Application Data;;30,24386;30,29841;0,054553;;0,045528;0,009025;-0,036503
383;30,29841;192,168,100,21;162.159.130.234;TCP;54;61541  >  443 [ACK] Seq=55 Ack=10307 Win=510 Len=0;;30,29841;30,30744;0,009025;;-0,072598;0,081623;0,154221
385;30,30744;192,168,100,21;142,251,12,94;TCP;66;62450  >  80 [SYN] Seq=0 Win=64240 Len=0 MSS=1460 WS=256 SACK_PERM=1;;30,30744;30,38906;0,081623;;0,081617;6E-06;-0,081611
391;30,38906;142,251,85,71;192,168,100,21;TCP;1462;[TCP Out-Of-Order] 443  >  62449 [ACK] Seq=1 Ack=518 Win=66816 Len=1408;;30,38906;30,38907;6E-06;;-0,013356;0,013362;0,026718
392;30,38907;142,251,85,71;192,168,100,21;TCP;1462;[TCP Out-Of-Order] 443  >  62449 [ACK] Seq=1409 Ack=518 Win=66816 Len=1408;;30,38907;30,40243;0,013362;;-0,004135;0,017497;0,021632
393;30,40243;50,116,58,41;192,168,100,21;TLSv1,2;80;Application Data;;30,40243;30,41993;0,017497;;-0,001937;0,019434;0,021371
394;30,41993;192,168,100,21;142,251,12,94;TCP;66;62452  >  80 [SYN] Seq=0 Win=64240 Len=0 MSS=1460 WS=256 SACK_PERM=1;;30,41993;30,43936;0,019434;;0,0042;0,015234;0,011034
395;30,43936;192,168,100,21;142,251,85,71;TCP;54;62449  >  443 [ACK] Seq=518 Ack=5178 Win=132352 Len=0;;30,43936;30,45460;0,015234;;-0,095779;0,111013;0,206792
396;30,45460;192,168,100,21;50,116,58,41;TCP;54;51145  >  8443 [ACK] Seq=85 Ack=73 Win=509 Len=0;;30,45460;30,56561;0,111013;;0,042855;0,068158;0,025303
397;30,56561;192,168,100,21;142,251,12,94;TCP;66;62453  >  80 [SYN] Seq=0 Win=64240 Len=0 MSS=1460 WS=256 SACK_PERM=1;;30,56561;30,63377;0,068158;;0,067919;0,000239;-0,06768
398;30,63377;142,251,12,94;192,168,100,21;TCP;60;80  >  62450 [SYN, ACK] Seq=0 Ack=1 Win=4380 Len=0 MSS=1412;;30,63377;30,63401;0,000239;;-0,000659;0,000898;0,001557
